Query	ShortQuery	templateId	templateText	etalon_text	algorithm	score	timeout
Добрый день. Возвращаюсь ко вчерашнему вопросу.Если организация направляет на обучение сотрудника,но договор заключен и оплачен самим сотрудников,в таком случае учебный отпуск оплачивается? ответ прошу дать письменно	Как рассчитывается компенсация при увольнении в отпуске?	447609	Вот материал по вашему вопросу. Если это не совсем то, что нужно, я продолжу поиск  https://1gl.ru/#/document/16/53156/actual/	можно ли вызвать сотрудника из учебного отпуска	SbertT5	0.5383408665657043	0.3396165370941162
Добрый день !У руководителя отпуск 28 календарных дней. За много лет накопился неиспользованный отпуск. Можно ли ему выплатить компенсацию за неиспользованный отпуск, если он не увольняется?	Можно ли выплатить компенсацию за неиспользованный отпуск, если сотрудник не увольняется?	0				0.0	0.34413790702819824
Прошу проконсультировать: Работница выходит из отпуска до 1,5 лет и работает 40 часов , имеет ли право на пособие за счет СФР по уходу за ребенком	Как рассчитывается пособие за уход за ребенком после отпуска по уходу до 1,5 лет?	0				0.0	0.1999361515045166
Здравствуйте!  Работник был переведен на должность начальника отдела и с этой должности ушел в очередной оплачиваемый отпуск. В новой должности отработал 10 дней. Затем приказ о переводе был признан работодатель незаконно изданным. Должен ли работник вернуть отпускные, в частности за отработанные 10 дней?	Работник переведен на новую должность и ушел в отпуск. После этого перевод был признан незаконным. Должен ли работник вернуть отпускные за отработанные дни?	0				0.0	0.3048892021179199
Доброе утро. Подскажите, как правильно заполнить периоды работы в СЗВ-Стаж ( имею в виду в отчете ЕФС-1) за 2023г, если у сотрудника был отпуск по уходу за ребенком и в этом же периоде она выполняла работы по договору ГПХ? Какой период сначала указывать?	Как заполнять периоды работы в СЗВ-Стаж, если у сотрудника был отпуск по уходу за ребенком и в этом же периоде она выполняла работы по договору ГПХ?	0				0.0	0.42017555236816406
Правильно ли я поняла, что сотруднику находящемуся в ежегодном оплачиваемом отпуске (в нашем случае внешнему совместителю) больничный по уходу за ребенком на этот период не оплачивается?	Оплата больничного по уходу за ребенком в ежегодном оплачиваемом отпуске у внешнего совместителя.	0				0.0	0.34650731086730957
Добрый день Просьба проконсультировать.  Сотрудник в мае отработал не полный месяц был на больничном листе , дни б/л пршлись на праздничные дни (05.05.2023-11.05.2023= всего 7 дней) . При расчете в декабре отпускных ,  при расчете дней расчетного периода программа расчитывает дни в мае не учитывая праздничные дни, берет в расчет только дни если бы он работал. (29/31*28=26,46) , это верно?	Как рассчитывать отпускные дни, учитывая праздничные дни?	0				0.0	0.21599268913269043
отец хочет уйти  в отпуск по уходу за ребенком до 1,5 лет. Он работает на основном месте работы и по совместительству, может ли он по совместительству попросит работодателя оформить пособие до 1,5 лет	Может ли отец по совместительству попросить работодателя оформить пособие до 1,5 лет?	0				0.0	0.20343279838562012
Здравствуйте! При увольнении сотрудника в июле месяца были неверно рассчитаны его расчетные (компенсация отпуска). Если сейчас ему доначислить, довыплатить, то надо ли считать ему компенсацию за задержку с компенсации отпуска?	При увольнении сотрудника, если расчетные рассчитаны неверно, надо ли считать компенсацию за задержку с компенсацией отпуска?	0				0.0	0.39998817443847656
Здравствуйте. В отчёте сзв-стаж нужно ли указывать МКС с районным коэффициентом 1,7 при отпуске по уходу за ребёнком, период временной нетрудостпособноти?	Как указывать МКС с районным коэффициентом при отпуске по уходу за ребенком?	491185	Вот материал по вашему вопросу. Если это не совсем то, что нужно, я продолжу поиск  https://1gl.ru/#/document/86/523840/actual/	работа в отпуске по уходу за ребенком сзв-стаж	SbertT5	0.8653753995895386	0.3546152114868164
Сотрудник ушел в отпуск на  14 дней и будучи в отпуске просит еще отпуск на 12 дней. Вопрос на следующие 12 дней в какой срок нужно выплатить отпускные?	Как рассчитывается компенсация при увольнении в отпуске?	0				0.0	0.40903544425964355
Здравствуйте! Уточните пожалуйста может ли сотрудница во время отпуска по беременности и родам и при получении пособия по бир работать	Может ли сотрудница работать во время отпуска по беременности и родам и при получении пособия по бир?	550834	Вот материал по вашему вопросу. Если это не совсем то, что нужно, я продолжу поиск  https://1gl.ru/#/document/12/457382/actual/	можно ли сотруднице работать по основному месту работы в отпуске по беременности и родам и получать пособие	SbertT5	0.9051033854484558	0.4090127944946289
подскажите пожалуйста. Может ли директор организации единственный учредитель брать отпуск без сохранения заработной платы на длительный срок например 1-2 месяца?	Может ли директор организации единственный учредитель брать отпуск без сохранения заработной платы на длительный срок например 1-2 месяца?	0				0.0	0.40952038764953613
сотрудник идет в отпуск в феврале 2024 года в январе 2024 выплачена годовая  премия за 2023 г. , а в феврале 2023 годовая премия за 2022 год . какая премия войдет в расчёт	Какая премия войдет в расчет для сотрудника, который идет в отпуск в феврале 2024 года, а в январе 2024 года выплачена годовая премия за 2023 г., а в феврале 2023 годовая премия за 2022 год?	534244	Вот материал по вашему вопросу. Если это не совсем то, что нужно, я продолжу поиск  https://1gl.ru/#/document/16/56797/actual/	премия за 2022 год выплачена в феврале особенности расчета среднего	SbertT5	0.8715807795524597	0.3468942642211914
Если в отчетном периоде не было работников, которые работникам, которые в отчетном периоде:  выполняли работу, которая дает право на досрочную пенсию; работали в сельском хозяйстве и при исчислении стажа работы которых применяется список работ, производств, профессий, должностей, специальностей, в соответствии с которым устанавливают повышение размера фиксированной выплаты к страховой пенсии по старости и к страховой пенсии по инвалидности (ч. 14 ст. 17 Закона от 28.12.2013 № 400-ФЗ); формировали свои пенсионные права в соответствии с Законом от 15.05.1991 № 1244-1 «О социальной защите граждан, подвергшихся воздействию радиации вследствие катастрофы на Чернобыльской АЭС»; замещали государственные или муниципальные должности, а также должности государственной гражданской службы и муниципальной службы; работали полный навигационный период на водном транспорте, полный сезон на предприятиях и в организациях сезонных отраслей промышленности, вахтовым методом; работали в период отбывания наказания в виде лишения свободы; имели периоды простоя или отстранения от работы; имели периоды освобождения от работы с сохранением места работы на время исполнения государственных или общественных обязанностей; находились в отпуске по уходу за ребенком в возрасте от полутора до трех лет, в отпуске без сохранения зарплаты. ТО СЗВ-СТАЖ сдавать не нужно до 25.01.2024?	Как считать отпуск, когда работник находился в отпуске без сохранения зарплаты?	0				0.0	0.572378396987915
Добрый день, у нашего сотрудника накопился ежегодный оплачиваемый отпуск 84 календарных дня. Можем ли мы выплатить компенсацию за отпуск за 56 дней?	Можно ли выплатить компенсацию за отпуск меньше, чем накопился отпуск?	0				0.0	0.3756246566772461
Здравствуйте. Нужно ли посылать Форму ЕФС-1 по стажу, если все работники работали, у них нет отпусков за свой счет, отпуска по беременности и по уходу за ребенком и т.п.? 1С ЗУП ничего не заполнила.	Как отразить в СЗВ-СТАЖ выход на неполный рабочий день из отпуска по уходу до 1.5 лет с сохранением пособия?	0				0.0	0.20741605758666992
Добрый день! Если сотрудник идет в отпуск, но в его расчетном периоде за 12 месяцев - 10 месяцев он находился на больничном, то в расчет брать ли 2 месяца его фактической зарплаты ?	Как рассчитывать зарплату сотрудника, если он был в отпуске и на больничном?	0				0.0	0.438551664352417
как указывать отпуск по уходу за ребенком до 1,5 лет и отпуск по уходу за ребенком до 3 лет в СЗВ-Стаж (в составе ЕФС-1)?	Как указывать отпуск по уходу за ребенком до 1,5 лет и отпуск по уходу за ребенком до 3 лет в СЗВ-Стаж (в составе ЕФС-1)?	0				0.0	0.20386815071105957
Добрый день! Подскажите, 29.12.2023 года была рассчитана заработная плата за декабрь 2023 , планируемая дата выплаты 12.01.2024 г, сегодня 10.01.2024 г.  нам предоставили свидетельство о смерти сотрудника, умер он 24.12.2023 г., заявления от родственников на выплату им причитающихся денежных средств (ЗП и компенсации отпуска при увольнения) еще нет. Как должны начисляться страховые взносы и НДФЛ на данные суммы?	Как рассчитывается страховая выплата при смерти сотрудника?	0				0.0	0.305966854095459
Екатерина, проконсультируйте, пжлста, в какие сроки нужно сдать отчет с января 2024 года? ПОДРАЗДЕЛ 1.2 ЕФС-1 ПО СОТРУДНИЦАМ, УХОДЯЩИМ В ОТПУСКА ПО БИР И ПО УХОДУ ЗА РЕБЕНКОМ	Как считать сроки сдачи отчета с января 2024 года для сотрудниц, уходящих в отпуск по беременности и по уходу за ребенком?	572810	Вот материал по вашему вопросу. Если это не совсем то, что нужно, я продолжу поиск  https://1gl.ru/#/document/86/669812/actual/	ефс-1 подраздел 1.2. сроки сдачи	SbertT5	0.6194076538085938	0.36942243576049805
Добрый день! Вопрос по заполнению формы статистики 1-Т (условия труда). В течение года была выплачена компенсация ежегодного дополнительного оплачиваемого отпуска при увольнении работников. Должна ли быть эта сумма отражена по строке 20 раздела 2 формы?  По строке 23 необходимо показать сумму выдаваемого молока или других равноценных пищевых продуктов. У нас молоко заменено денежной компенсацией. Сумму денежной компенсации необходимо показать по строке 23 формы или здесь только расходы на физическую выдачу молока должны быть отражены?	Как отразить в форме статистики 1-Т компенсацию ежегодного дополнительного оплачиваемого отпуска при увольнении работников и расходы на физическую выдачу молока или их денежную компенсацию?	0				0.0	0.2481532096862793
"Выдержка из Вашего ответа: ......, только 7 дней можно заменить компенсацией. Я прочитала ваши пояснения и из п. ""Когда заменить отпуск компенсацией нельзя"" и поняла, что допустимо заменить только в части, превышающей 7 календарных дней, а у нас не превышает..."	Как заменить отпуск компенсацией, если превышение дней отпуска не достигает 7 дней?	450005	Вот материал по вашему вопросу. Если это не совсем то, что нужно, я продолжу поиск  https://1gl.ru/#/document/16/56069/actual/	когда отпуск можно заменить денежной компенсацией	SbertT5	0.6896703839302063	0.40461277961730957
Можно ли уволить сотрудника, который  находиться в декретном отпуске по уходу за ребенком от 1,5 до 3-х лет без содержания?	Можно ли уволить сотрудника в декретном отпуске без содержания?	585399	Вот материал по вашему вопросу. Если это не совсем то, что нужно, я продолжу поиск  https://1gl.ru/#/document/86/694198/actual/	как уволить сотрудника находящегося в отпуске по уходу за ребенком до 1,5 лет	SbertT5	0.9895479083061218	0.35801029205322266
Добрый день.                                              У меня вопрос по расчету отпускных. Если у работника прогул или он брал дни без сохранения зарплаты, при расчете отпускных учитывается полный календарный месяц и коэффициент ?	Как рассчитывается коэффициент отпуска при прогуле или днях без сохранения зарплаты?	464139	Вот материал по вашему вопросу. Если это не совсем то, что нужно, я продолжу поиск  https://1gl.ru/#/document/86/410652/actual/	дни отпуск без сохранения заработной платы входят в расчет отпускных	SbertT5	0.6849952936172485	0.36049342155456543
Здравствуйте, сотрудник, устроенный 01.08.2023 года, просит выплатить ему компенсацию за неиспользованный отпуск. Это можно сделать или это делается в момент увольнения?	Как выплачивать компенсацию за неиспользованный отпуск при увольнении?	450005	Вот материал по вашему вопросу. Если это не совсем то, что нужно, я продолжу поиск  https://1gl.ru/#/document/16/56069/actual/	можно ли выплачивать компенсация за неиспользованный отпуск, не связанная с увольнением при переходящем отпуске	SbertT5	0.9006088972091675	0.40567684173583984
Добрый день! Подскажите, пожалуйста, может ли сотрудница при уходе в 2024 г. в декретный отпуск, поменять года на 21 и 22 г. Беременность вторая	Может ли сотрудница при уходе в декретный отпуск, поменять года на 21 и 22 г. Беременность вторая?	0				0.0	0.19701766967773438
Добрый день. в 2022 при выплате материальной помощи мобилизованному был удержан НДФЛ. После выхода разъяснений по поводу того, что помощь мобилизованным, членам их семей является необлагаемым доходом, сотруднику было направлено уведомление о возможном возврате НДФЛ.  в мае 2023, находясь в отпуске, сотрудник подал заявление на возврат излишне удержанного налога. Как в 6НДФЛ за 2023 год отразить данную сумму возврата? в разделе 1,2 понятно по каким строкам должно все проходить. у сотрудника в 2023 по организации не проходит доход, и в приложении 1 в сведениях о доходах и суммах налогов у него будет пусто кроме строки Сумма излишне удержанная налоговым агентом? ну так пойдет ошибка чисто математическая - без доходов и удержанного налога появился излишне удержанный.	Как отразить в 6НДФЛ сумму возврата излишне удержанного налога?	0				0.0	0.3128659725189209
Имеет сотрудник право на отпуск по уходу за пожилыми больными родителями? (инсульт и деменция) На какой срок? Справки все есть. Этот отпуск оплачивается или за свой счет?	Какое право имеет сотрудник на отпуск по уходу за пожилыми больными родителями?	576193	Вот материал по вашему вопросу. Если это не совсем то, что нужно, я продолжу поиск  https://1gl.ru/#/document/86/676530/actual/	больничный оплачивается в отпуске за свой счет	SbertT5	0.8405585885047913	0.3582763671875
Работник предприятия принес вызов на сессию с 20 декабря по 14 января 2024 года. Как  правильно оплатить учебный отпуск? Должны ли быть оплачены дни с 1 января по 8 января 2024 года	Как оплачивать учебный отпуск, когда он включает праздничные дни?	0				0.0	0.2581472396850586
Добрый день. Сотрудница ни дня не работала. с дня приема находилась в отпуске по уходу до 1,5 лет . Как рассчитать окончательный расчет при увольнении ?	Как рассчитывать отпуск в праздничные дни?	0				0.0	0.4054732322692871
Добрый день. Подскажите пожалуйста, в организации к ежегодному отпуску 28 дней у не которых сотрудников добавляется 7 дней за вредность. Нужно их отдельно выделять в графике отпуско?	Как отдельно выделять в графике отпуска добавленные дни за вредность?	0				0.0	0.40853023529052734
Доброе утро! Страховые взносы рассчитываются с начисленной з/пл или какую то роль играет выплата зар. платы например отпускных ранее их начисления ? Если сотрудник не получил зар. плату по каким то причинам страховые взносы перечисляются всё равно?	Как рассчитываются страховые взносы с начисленной зарплаты или с выплатами, таких как отпускные?	0				0.0	0.5117948055267334
