Query	ShortQuery	templateId	templateText	etalon_text	algorithm	score	timeout
Добрый день. У нас есть сотрудник, который имеет право на дополнительный ежегодный отпуск для тех, кто пострадал в результате аварии на Чернобыльской АЭС. В форме ЕФС-1 за 2023 год у него проставляется этот отпуск с параметром НЕ ОПЛ. Нужно его поменять на ЧАЭС?	Как изменить параметр отпуска в форме ЕФС-1 с НЕ ОПЛ на ЧАЭС?	0				0.0	0.20503711700439453
Добрый день! Если сотрудник отгулял отпуск авансом в 2023 года за 2024 год, мы его должны включить в график отпусков?	Как рассчитывается компенсация при увольнении в отпуске?	0				0.0	0.407590389251709
Иностранный работник (гражданин Узбекистана) убывает в отпуск на 2 месяца, должен ли работодатель подавать данные в миграционную службу об убытии работника	Обязательно ли подавать данные в миграционную службу об убытии иностранного работника на отпуск?	403695	Вот материал по вашему вопросу. Если это не совсем то, что нужно, я продолжу поиск  https://1gl.ru/#/document/16/117241/actual/	иностранный работник отпуск за свой счет	SbertT5	0.6200616359710693	0.4094221591949463
Добрый день. В связи с изменением законодательства в 2024 году, работница, находящаяся в отпуске по уходу за ребенком до 1,5 лет планирует выйти на полный рабочий день с сохранением ежемесячного пособия по уходу. Возможно ли это? Каким образом оформляется такая ситуация?	Как оформляется переход на полный рабочий день с сохранением пособия по уходу за ребенком до 1,5 лет?	0				0.0	0.22300958633422852
Добрый день! Подскажите, пожалуйста, если генеральный директор является по совместительству  начальником производства, при направлении генерального директора в командировку обязательно  оформлять отпуск без сохранения оплаты на начальника производства?	Можно ли оформлять отпуск без сохранения оплаты на начальника производства, если генеральный директор является по совместительству начальником производства?	0				0.0	0.19095683097839355
Добрый вечер. Сотрудница пошла в отпуск  по БиР, БЛ мы получили по ЭДО, данные отправили. А как отправить данные на получение пособия при том, что встала на учет на раннем сроке беременности.. Где это нужно отправлять? Это тоже работодатель отправляет? Спасибо	Как отправить данные на получение пособия при ранней беременности?	0				0.0	0.20253992080688477
Добрый день. Раньше СЗВ стаж мы раз в год сдавали, сейчас разобраться не можем нужно нам сдавать ЕФС-1 ? Если работник 2 недели был в отпуске без сохранения з/платы, а так же на предприятии есть работник мобилизованный с начало СВО.	Как сдавать СЗВ стаж с учетом отпуска без сохранения зарплаты и мобилизации работника?	0				0.0	0.5080900192260742
Добрый день! Вопрос по начислению отпускных: у работника на основном месте работы оклад 35000 руб, еще он в этой же организации по совместительству работает водителем на полставки и оклад у него 10000 р. Работник уходит в отпуск с 09.01.2024 на 28 дней. Подскажите, отпускные считать по каждой должности отдельно или все вместе? Если я беру отдельно 10000, ваш расчетчик не понимает что это полставки и выдает результат, исходя из МРОТ.	Как рассчитывать отпускные по двум должностям?	0				0.0	0.5124161243438721
Добрый день, пришлите, пожалуйста, образец справки с места работы сотрудницы, находящейся в отпуске по уходу за ребенком до 3 лет	Как написать образец справки с места работы сотрудницы, находящейся в отпуске по уходу за ребенком до 3 лет?	0				0.0	0.4076204299926758
Добрый день. Из какой минималки должен считаться средний для расчета отпуска сотруднику уходящему в отпуск после декрета? Федеральной или по Москве, организация зарегистрирована в г. Москве. (Средний исходя из заработка сотрудника до ухода в декрет меньше ,чем расчет из минималки).	Как рассчитывается компенсация при увольнении в отпуске?	0				0.0	0.18790841102600098
Может ли сотрудник уволится или уйти в отпуск в нерабочий праздничный день? ТК РФ? когда нужно в таких случаях выплачивать расчет?	Может ли сотрудник уволиться или уйти в отпуск в нерабочий праздничный день?	0				0.0	0.32594943046569824
Добрый день! Подскажите, если сотрудница с 01 августа 2023 года в отпуске по беременности и родам, а в январе 2024 увольняется, какой период брать с начислениям з/п при расчете компенсации : с 01.08.2022 по 31.07.23 или с 01.01.2023 по 31.07.23.?	Какой период брать с начислениями з/п при расчете компенсации для сотрудницы, увольняющейся в январе 2024 года, но находившейся в отпуске по беременности и родам с 01 августа 2023 года?	0				0.0	0.3056917190551758
Добрый день! Сотрудник на время срочной службы (1 год) не был уволен, трудовой договор был приостановлен на это время. Положен ли трудовой отпуск за этот период?	Положен ли трудовой отпуск за время приостановления трудового договора на срочную службу?	0				0.0	0.39499831199645996
Добрый день! Нужно ли сдавать СЗВ--СТАЖ в СФР, если у сотрудников в течение 2023 года не было никаких отклонений (отпусков за свой счет, больничных и т.д.)?	Как сдавать СЗВ-СТАЖ в СФР, если сотрудники не имели отклонений в 2023 году?	0				0.0	0.41992759704589844
"Доброе утро! Подскажите, пожалуйста. Сотрудница собралась в отпуск по БиР. Оф.трудоустроена в 2023 году, с 2020-2022 год нигде не была трудоустроена, имела статус самозанятой, с 2016-2019 работала на полставки от МРОТ. Можно не заменять периоды, оставить 2022,2021? И если их можно оставить, то какой доход указывать ""0"" или величину МРОТ за соответствующие периоды?"	Как рассчитывается компенсация при увольнении в отпуске?	0				0.0	0.21536016464233398
Добрый день, есть ли какие то обязанности у работодателя предоставлять отпуск в период когда хочет работник? По сотрудникам многодетным и тем у кого школьники обязаны предоставить летом? По остальным сотрудникам работодатель сам решает когда отпустить?	Какие обязанности у работодателя по предоставлению отпуска сотрудникам?	0				0.0	0.23206543922424316
Добрый день. У сотрудницы заканчивается отпуск по уходу за ребенком до 1,5 лет. Какие документы необходимо оформить для оформления отпуска по уходу за ребенком до 3-х лет?	Какие документы необходимо оформить для оформления отпуска по уходу за ребенком до 3-х лет?	585400	Вот материал по вашему вопросу. Если это не совсем то, что нужно, я продолжу поиск  https://1gl.ru/#/document/86/694201/actual/	какие документы нужно оформлять при уходе в отпуск по уходу за ребенком до 1,5 лет	SbertT5	0.9837726354598999	0.32726001739501953
Подскажите, пожалуйста, если наша сотрудница находясь в отпуске по уходу за ребенком до 1,5 лет, сейчас хочет выйти на неполный рабочий день - как это оформить и не будет ли у нее уменьшено пособие?	Как оформить выход на неполный рабочий день из отпуска по уходу за ребенком до 1,5 лет?	585400	Вот материал по вашему вопросу. Если это не совсем то, что нужно, я продолжу поиск  https://1gl.ru/#/document/86/694201/actual/	как оформить сотруднику отпуск по уходу за ребенком до 1,5 лет	SbertT5	0.5076032876968384	0.5683286190032959
Добрый день! Скажите пожалуйста как правильно заполнить в отчете за 2023 год отчет по стажу, если сотрудник был в отпуске без содержания.	Как правильно заполнить отчет по стажу, если сотрудник был в отпуске без содержания?	0				0.0	0.39884042739868164
Добрый день! У меня вопрос. Иностранному сотруднику на патенте начислена материальная помощь к отпуску. По какой ставке рассчитать НДФЛ? И можно ли сумму этого НДФЛ зачесть в счет фиксированных платежей ?	Как рассчитывать НДФЛ для иностранного сотрудника, получающего материальную помощь к отпуску?	0				0.0	0.39229369163513184
"Здравствуйте! В отчете сзв стаж (Страховые взносы, сведения о стаже сотрудников ЕФСкакие параметры ) за 2023 г указать, если сотрудник получил компенсацию за неиспольз отпуск при увольнении "" НЕОПЛ"" или вообще не указывать в графе ?"	"Как указать компенсацию за неиспольз отпуск при увольнении ""НЕОПЛ"" в отчете сзв стаж?"	491181	Вот материал по вашему вопросу. Если это не совсем то, что нужно, я продолжу поиск  https://1gl.ru/#/document/86/523846/actual/	как в сзв стаж указать отпуск за свой счет	SbertT5	0.705673098564148	0.4259636402130127
Добрый день! В 2023 году работнице, вышедшей из отпуска по уходу за ребенком расчетный период для расчета больничного, по ее заявлению заменили на 2018 и 2019 год. (2020 по 2022 пособие по уходу за ребенком, по уходу до 1,5 лет) Можем ли мы в 2024 году заменить 2022 год на 2019 и в расчете использовать зар.плату за 2019 и 2023 годы	Можно ли заменить расчетный период для расчета больничного в 2024 году на 2019 и 2023 годы?	588144	Вот материал по вашему вопросу. Если это не совсем то, что нужно, я продолжу поиск  https://1gl.ru/#/document/86/697952/actual/	заявление на пособие по уходу за ребенком до 1,5 лет	SbertT5	0.7719360589981079	0.3803548812866211
Здравствуйте, подскажите пожалуйста при расчете компенсации отпуска при увольнении, включается ли в периоды отсутствия, которые повлияли на расчет рабочего года, отпуск по беременности и родам. Спасибо	Как рассчитывается компенсация при увольнении в отпуске?	0				0.0	0.18405818939208984
Добрый день! Подскажите, пожалуйста на кого нужно подавать сведения ЕФС-1 за 2023 год? Я поняла что на работников, которые оформляли отпуск без сохранения зарплаты, отпуск по уходу за ребенком. Я перечислила только в нашем случае.	Как рассчитывается компенсация при увольнении в отпуске?	0				0.0	0.37666988372802734
Добрый день! ООО, директор и учредитель в 1 лице. Уходит в декретный отпуск. Временно исполняющий обязанности генерального директора назначен по приказу. Надо ли вносить изменения в уставные документы или уведомлять какие-либо инстанции.	Нужно ли вносить изменения в уставные документы или уведомлять какие-либо инстанции при назначении временно исполняющего обязанности генерального директора в ООО, где директор и учредитель в 1 лице?	37763	Вот материал по вашему вопросу. Если это не совсем то, что нужно, я продолжу поиск  https://1gl.ru/#/document/118/18177/actual/	директор ушел в отпуск образец приказа на исполняющего обязанности	SbertT5	0.8404922485351562	0.32079434394836426
Здравствуйте, подскажите пожалуйста сотрудница написала заявление на отпуск по уходу за ребенком до 1,5 лет. Организация должна оформить приказ сразу до 3-х лет? Нужна ли справка от отца о неполучении пособия. Спасибо	Как оформлять приказ на отпуск по уходу за ребенком до 1,5 лет?	0				0.0	0.19028663635253906
Здравствуйте! Сотрудник работает дистанционно в г. Пермь. Ему положен дополнительный ежегодный отпуск т.к. он работает в местности с особыми климатическими условиями?	Можно ли сотруднику, работающему дистанционно в г. Пермь, выдать дополнительный ежегодный отпуск из-за особых климатических условий?	0				0.0	0.4839138984680176
Здравствуйте! Такой вопрос: Сотрудник Иванов получает зарплату за февраль 03.03 и аванс за март 20.03, обе выплаты попадают в третий срок перечисления (уведомление по ЕНП), затем 30.03 он получает отпускные. Данная выплата уже попадает в первый срок перечисления во второй квартал. Должна ли эта выплата попасть в отчет 6НДФЛ за 1й квартал, если в уведомление по ЕНП эта сумма уже идет во втором квартале в первый срок перечисления.	Как рассчитывается компенсация при увольнении в отпуске?	0				0.0	0.22125625610351562
Сотрудница в сентябре ушла в отпуск по беременности и родам. Можем ли мы ей выплатить квартальную премию за 3 квартал ?	Можно ли выплатить премию за 3 квартал сотруднице, которая ушла в отпуск по беременности и родам?	534540	Вот материал по вашему вопросу. Если это не совсем то, что нужно, я продолжу поиск  https://1gl.ru/#/document/16/129474/actual/	как выплатить ежемесячные, квартальные и полугодовые премии	SbertT5	0.7663689255714417	0.3920154571533203
"Здравствуйте! Сотрудник решил пойти в дополнительный ""чернобыльский"" отпуск последние 14 дней года и принес больничный, который пересекается с отпуском на 1 день, то есть первый день начала отпуска. Нам оплачивать больничный все дни и переносить этот 1 день на 01.01.2024, либо 1 день больничного не оплачиваем?"	Как оплачивать больничный, когда он пересекается с отпуском на 1 день?	0				0.0	0.5139086246490479
Добрый день! Генеральный директор не ходит в отпуск несколько лет. Что делать с накопившимия днями отпуска? Можно ли их списать?	Как рассчитывается компенсация при увольнении в отпуске?	0				0.0	0.20236444473266602
А как же эти условия????????Подраздел 1.2 подраздела 1 заполняют и сдают работодатели только по работникам, которые в отчетном периоде:  выполняли работу, которая дает право на досрочную пенсию; работали в сельском хозяйстве и при исчислении стажа работы которых применяется список работ, производств, профессий, должностей, специальностей, в соответствии с которым устанавливают повышение размера фиксированной выплаты к страховой пенсии по старости и к страховой пенсии по инвалидности (ч. 14 ст. 17 Закона от 28.12.2013 № 400-ФЗ); формировали свои пенсионные права в соответствии с Законом от 15.05.1991 № 1244-1 «О социальной защите граждан, подвергшихся воздействию радиации вследствие катастрофы на Чернобыльской АЭС»; замещали государственные или муниципальные должности, а также должности государственной гражданской службы и муниципальной службы; работали полный навигационный период на водном транспорте, полный сезон на предприятиях и в организациях сезонных отраслей промышленности, вахтовым методом; работали в период отбывания наказания в виде лишения свободы; имели периоды простоя или отстранения от работы; имели периоды освобождения от работы с сохранением места работы на время исполнения государственных или общественных обязанностей; находились в отпуске по уходу за ребенком в возрасте от полутора до трех лет, в отпуске без сохранения зарплаты.	Как рассчитывается компенсация при увольнении в отпуске?	0				0.0	0.30567073822021484
Добрый день, подскажите, пожалуйста, если за 2023год по новым правилам никто не попадает из сотрудников в СЗВ-Стаж (нет ни декретниц, ни отпуска за свой счет,) то тогла нулевой отчет сдавать не нужно?	Нужно ли сдавать СЗВ-Стаж отчет для сотрудников, которые не попадают в СЗВ-Стаж по новым правилам?	491181	Вот материал по вашему вопросу. Если это не совсем то, что нужно, я продолжу поиск  https://1gl.ru/#/document/86/523846/actual/	в отчете сзв стаж отпуск за свой счет отражать	SbertT5	0.9120549559593201	0.345736026763916
Здесь написано, что можно взять только 2020 и 2021 годы, но она в эти годы была в отпуске по уходу за ребенком, у нее не было доходов.	Как рассчитывается компенсация при увольнении в отпуске?	0				0.0	0.3735520839691162
Доброго дня. подскажите пожалуйста, мы создаем резервы на отпуск в бухгалтерском и налоговом учете. В гл. 25 НК РФ правила определения предельной суммы отчислений не установлены. Мы делаем расчет на основании данных ФОТ и пр., получаем по расчету сумму например 489тр. Можем ли мы округлить предельную сумму отчислений до 500тр?	Можно ли округлить предельную сумму отчислений до 500 тр.?	0				0.0	0.20217370986938477
