Query	ShortQuery	templateId	templateText	etalon_text	algorithm	score	timeout
Добрый день!Нужно ли сдавать СЗВ-Стаж если у сотрудников не было ни отпуска за свой счет и никаких других  мероприятий, то есть пустой	Как сдавать СЗВ-Стаж, если у сотрудников не было отпуска за свой счет и других мероприятий?	491181	Вот материал по вашему вопросу. Если это не совсем то, что нужно, я продолжу поиск  https://1gl.ru/#/document/86/523846/actual/	отпуск за свой счет как сдавать сзв-стаж	SbertT5	0.8918302655220032	0.3863396644592285
У нас есть сотрудник,который трудоустроен в 2021 году и сейчас увольняется. За весь период выплаты ЗП не производились. На данный момент имеется компенсация отпуска 2,33 дня. Должны ли мы оплатить данную компенсацию исходя из МРОТ?	Как рассчитывается компенсация при увольнении в отпуске?	0				0.0	0.43148255348205566
у работника пятидневка , он хочет в отпуск с понедельника на 7 календарных дней... директор возражает.. говорит со среды по среду.. правомерно ли ?	Как рассчитывается отпуск для работника с пятидневной рабочей неделей, если он хочет в отпуск с понедельника на 7 календарных дней?	0				0.0	0.41250085830688477
Добрый день, подскажите  сотруднику положен дополнительный отпуск , в течении года он был на больничном,  в этом случае мы можем уменьшить количество дней дополнительного отпуска?	Можно ли уменьшить количество дней дополнительного отпуска, если сотрудник был на больничном?	0				0.0	0.40313172340393066
А как поступить в случае, если сотрудник оформляет отпуск по уходу за ребенком 10.01.24, а выходит из отпуска 11.01.2024 на полную ставку (сейчас же разрешено получать пособие по уходу за ребенком и работать на полную ставку), нужно ли в данном примере отправлять ЕФС-1 с типом сведений «Назначение выплат по ОСС»?	Как отразить в СЗВ-СТАЖ выход на неполный рабочий день из отпуска по уходу до 1.5 лет с сохранением пособия?	0				0.0	0.3682267665863037
Добрый день!  Подскажите пожалуйста, если у предприятия не было таких случаев  Простой Отстранение от работы Отпуск по уходу за ребенком от полутора до трех лет Отпуск за свой счет Приостановка трудового договора из-за мобилизации Периоды освобождения от работы с сохранением места работы на время исполнения государственных или общественных обязанностей Надо подовать отчет, или нет? Спасибо!	Какие виды отпуска и освобождений от работы требуют подачи отчета?	0				0.0	0.2157278060913086
Работник отработал 2 месяца, из них 10 дней был в административном отпуске (хоктически прогулы). Учитывать ли эти дни при расчете компенсации за неиспользованный отпуск при увольнении?	Как рассчитывается компенсация за неиспользованный отпуск при увольнении, учитывая административный отпуск и прогулы?	0				0.0	0.23544096946716309
Добрый день! Подскажите пожалуйста, сотрудник два года был на больничном, накопилось 56 дней не использованного отпуска. нам из какого расчета считать отпускные и каким образом отразить в графике отпусков?	Как рассчитывать отпускные для сотрудника с накопившимся больничным?	0				0.0	0.3072948455810547
Добрый день. В компании у сотрудника накопился ежегодный оплачиваемый отпуск в размере 60 дней. Согласно графика отпусков в этом году он сможет сходить в ежегодный оплачиваемый отпуск только на 28 дней, на большее не позволяет коммерческая деятельность компании. Вопрос: может ли компания выплатить сотруднику компенсацию согласно ст. 126 ТК РФ за 32 дня, из расчета 60 дней (остаток ежегодного оплачиваемого отпуска) минус 28 дней (ежегодный оплачиваемый отпуск согласно графика отпусков) разница 32 дня (остаток)?	Может ли компания выплатить компенсацию за неиспользованный отпуск в соответствии с ст. 126 ТК РФ?	0				0.0	0.18889999389648438
Здравствуйте! У нас работают вахтовики. Работают по 15 дней. Не можем разобраться, как правильно предоставить отпуск 28 дней. Понятно, что он предоставляется сразу после междувахтового отдыха, а потом сразу 28 дней и работник должен выйти на работу на 29 день? Или учитывая, что за эти 28 дней у него по графику был еще один межвахтовый отдых, еще прибавляются эти дни?	Как рассчитывать отпуск для вахтовиков?	0				0.0	0.21266579627990723
Здравствуйте! Работникам находившимся в первую половину месяца в отпуске, командировке или на больничном не начисляется и не выплачивается аванс. Тем самым нарушается закон, о невыплате заработной платы каждые 15 дней. Как быть в таком случае?	Как начислять аванс заработной платы для работников, находящихся в отпуске, командировке или на больничном в первую половину месяца?	0				0.0	0.4152791500091553
Добрый день! Подскажите, пожалуйста, правильно я понимаю, что ЕФС-1 данные по стажу сотрудников подаются не на всех сотрудников, а только на тех, у которых был, например, отпуск без сохранения заработной платы?	На каких сотрудников подаются данные по стажу в ЕФС-1?	0				0.0	0.409975528717041
Добрый день! Как считать компенсацию при увольнении, если сотрудник был в отпуске за свой счет больше 1 года перед увольнением?	Как рассчитывается компенсация при увольнении, если сотрудник был в отпуске за свой счет больше 1 года перед увольнением?	464139	Вот материал по вашему вопросу. Если это не совсем то, что нужно, я продолжу поиск  https://1gl.ru/#/document/86/410652/actual/	расчет компенсации при увольнении в отпуске за свой счет	SbertT5	0.9067130088806152	0.353865385055542
Добрый день! Нужен письменный ответ! Работник находится в отпуске по уходу за ребенком до 3 лет по заявлению, выплата от ФСС была до 1,5 лет. С 28 декабря заканчивается отпуск по уходу за ребенком до 1,5 лет, как дальше оформить работнику отпуск от 1,5 до 3 лет работодателю в таком случае и кто выплачивает пособие до 3 дет ? Какое пособие и в каком размере на сегодняшний день положено работнику по закону?	Как оформить отпуск работника с 1,5 до 3 лет после отпуска по уходу за ребенком до 1,5 лет?	0				0.0	0.23580694198608398
Добрый день. У нас работает пенсионерка (то есть, её доходы это зарплата и пенсия). Она проживает в Бодайбо. У неё есть дочь, которая находится в отпуске по уходу за ребенком. Дочь проживает в Красноярске. Наша работница хочет взять отпуск по уходу за ребенком до 1,5 лет на 1 месяц, чтобы дочь вышла на работу. Можем ли мы предоставить ей такой отпуск?	Можем ли мы предоставить работнице отпуск по уходу за ребенком до 1,5 лет, если она проживает в другом городе и дочь находится в отпуске?	0				0.0	0.5361847877502441
добрый день,  подскажите пож если  сотрудница  в отпуске до 3-х лет  на временной ставке  ,  ее могут уволить  предупредив за две недели?   вызов из отпуска не нужен ?	Можно ли уволить сотрудника из отпуска без вызова?	554024	Вот материал по вашему вопросу. Если это не совсем то, что нужно, я продолжу поиск  https://1gl.ru/#/document/86/635268/actual/	сотрудник в отпуске увольняется отработка две недели	SbertT5	0.5829939246177673	0.3189723491668701
Вопрос: У директора 56 дей отпуска-28 осн и 28 доп. в апреле у него заканчивается контракт, и он его не хочет продлевать. Может ли он сейчас получить компенсацию за доп отпуск, пока у предприятия есть средства,	Может ли директор получить компенсацию за дополнительный отпуск, если он не хочет продлевать контракт?	0				0.0	0.18895721435546875
Добрый день. У сотрудницы дополнительные 20 дней отпуска по беременности и родам. Необходимо ли оформлять дополнительно заявление и приказ на эти 20 дней?	Как оформлять дополнительные дни отпуска по беременности и родам?	0				0.0	0.18657779693603516
Добрый вечер! Ситуация - с 1 окт. компания применяет увеличивающий коэффициент к ежемесячной премии, в связи с этим с работниками заключаются доп/соглашения к трудовым договорам. Следует ли проиндексировать среднюю заработную плату за отработанный год при расчете отпускных?	Как проиндексировать среднюю заработную плату при расчете отпускных с учетом увеличивающего коэффициента?	0				0.0	0.3951225280761719
Добрый день! Сотрудница находится в отпуске по уходу за ребенком до 3-х лет,   но в декабре текущего года она нам сообщила что снова собирается в декретный отпуск и у нее будет больничный лист. Вопрос: какие заявления она должна написать  и два предыдущих года у нее декрет замена лет по ее заявлению , и что нужно отправить в СФР в связи с этими событиями ?	Какие заявления должна написать сотрудница, которая находится в отпуске по уходу за ребенком до 3-х лет, а в декабре текущего года сообщила о намерении в декретный отпуск и у нее будет больничный лист?	0				0.0	0.44475507736206055
Добрый день! Подскажите, пожалуйста , вопрос касается начисления зарплаты за дни выхода в праздничные дни - 2 и 7 января 2024 г, девушка работает юрист-консультом , но данный момент  ей идёт доплата - 3 часа в день за начальника юридического отдела , так как данный начальник находится в декретном отпуске и работает  неполный день, вопрос состоит в следующем: Как в данном случае ей будет оплачиваться данные выходные дни , понятно в двойном размере, но полностью , исходя из её ставки + доплата за начальника отдела, правильно?	Как рассчитывается доплата за начальника отдела в праздничные дни?	0				0.0	0.5061249732971191
"То что прислали там нет подобной ситуации ""ЕФС1 (сзв стаж) как заполнить если сотрудник работает не полный рабочий день так как находится в отпуске по уходу за ребенком до 3 лет"""	Как заполнить ЕФС-1 для сотрудника, работающего неполный рабочий день в отпуске по уходу за ребенком до 3 лет?	491185	Вот материал по вашему вопросу. Если это не совсем то, что нужно, я продолжу поиск  https://1gl.ru/#/document/86/523840/actual/	работа в отпуске по уходу за ребенком сзв-стаж	SbertT5	0.8851754069328308	0.4112215042114258
Добрый день! Подскажите пожалуйста, нужно ли сдавать отчёт ЕФС1 СЗВ-стажж , если не было не каких из перечисленных ситуаций 🔵находились в отпуске по уходу за ребенком в возрасте от полутора до трех лет; 🔵в отпуске без сохранения зарплаты;  🔵имели периоды простоя или отстранения от работы; 🔵выполняли работу, которая дает право на досрочную пенсию; 🔵работали в с/х  и при исчислении стажа работы которых применяется список работ, в соответствии с которым устанавливают повышение размера фиксированной выплаты к страховой пенсии по старости и по инвалидности; 🔵формировали свои пенсионные права в соответствии с Законом от 15.05.1991 № 1244-1 О соц защите после ЧАЭС; 🔵замещали государственные или муниципальные должности; 🔵работали полный навигационный период на водном транспорте; 🔵на предприятиях сезонных отраслей промышленности, вахтовым методом; 🔵работали в период отбывания наказания в виде лишения свободы; 🔵имели периоды освобождения от работы с сохранением места работы на время исполнения гос. или общественных обязанностей;	Нужно ли сдавать отчёт ЕФС1 СЗВ-стажж, если не было никаких из перечисленных ситуаций?	0				0.0	0.5134930610656738
Добрый день, если сотрудник ушел в отпуск по уходу за ребенком до 1,5 лет, может ли он по собственному желанию выйти досрочно на работу?	Может ли сотрудник, который ушел в отпуск по уходу за ребенком до 1,5 лет, выйти досрочно на работу по собственному желанию?	0				0.0	0.40610313415527344
Работник увольняется в связи с выходом на пенсию, к моменту увольнения авансом использован отпуск. Суммы начисленной заработной платы недостаточно для удержания излишне выплаченных отпускных. Можно ли эти суммы удержать из дополнительного выходного пособия выплачиваемого согласно коллективному договору при выходе на пенсию?	Можно ли удерживать отпускные из дополнительного выходного пособия при увольнении в связи с выходом на пенсию?	419870	Вот материал по вашему вопросу. Если это не совсем то, что нужно, я продолжу поиск  https://1gl.ru/#/document/12/295348/actual/	как выплатить зарплату перед выходом в отпуск	SbertT5	0.5606731176376343	0.4178907871246338
Добрый день. Как начислить сотруднику отпускные, если он идет в отпуск с 01.02.24.? Выплатить их нужно 26 января. Зарплата за январь еще не будет начислена и сумма не известна, так как расчет зарплаты идет по фактически отработанному времени.	Как начислить сотруднику отпускные, если он идет в отпуск с 01.02.24 и выплатить их нужно 26 января, но зарплата за январь еще не будет начислена и сумма не известна?	0				0.0	0.5015933513641357
Здравствуйте! Помогите пожалуйста рассчитать новые сроки отпусков. работница принята на работу 19.04.2010 года, по срокам отгулены отпуска по 18.04.2020г. далее роды и декрет с 15.12.2020г по 19.05.2021г 156 дней, затем отпуск по уходу до 3 лет с 20.05.2021 года по 15.12.2023г. Какой будет следующий период отпуска (период с 19.04.2020 по 18.04.2021г тоже не успела отгулять)	Как рассчитывается следующий период отпуска для работницы, которая уже отгуляла отпуск по родам и декрету, а также отпуск по уходу до 3 лет?	0				0.0	0.30742549896240234
Здравствуйте. Вопрос такой: есть график отпусков, он утвержден и сотрудники ознакомлены. Могут ли сотрудника не отпустить по графику в отпуск, если не было переносов и должен ли сотрудник писать заявление на отпуск в этом случае	Может ли сотрудник отпуститься по графику, если он не был перенесен, и должен ли он писать заявление на отпуск в этом случае?	0				0.0	0.205735445022583
подскажите как правильно выплатить  отпуск с последующим увольнением , и как правильно  удержать и перечислить ндфл  в бюджет начало отпуска 18.01.24 окончание 14.02.2024	Как выплатить отпуск и удержать НДФЛ при увольнении сотрудника?	0				0.0	0.2109537124633789
добрый день !Сотрудница уходит в декретный отпуск с 6.01.2024г Для расчета больничного берем  предшествующие 2 года Но 2022 год ею отработан полностью а 2023г только 143 дня Расчет делать на 730 дней или на фактически отработанные дни	Как рассчитывать больничное при декретном отпуске с учетом фактически отработанных дней?	0				0.0	0.3008840084075928
Добрый день!  ИП вышла в декретный отпуск в октябре 2023 года.  Положены ли ей какие пособия по уходу в 2024 год?	Как рассчитываются пособия по декретному отпуску?	0				0.0	0.37367796897888184
сотрудница была в отпуске по уходу за ребенком. Вышла на работу, заболела. Может она написать заявление о переносе годов до беременности? какие еще документы должна предоставить. Работала до этого не у нас	Как рассчитывается компенсация при увольнении в отпуске?	0				0.0	0.21131324768066406
передать письменно. Подскажите если сотрудник хочет сейчас получить отпускные а отгулять в декабре. Наша компания не против. как законно это сделать	Как законно предоставить отпускные заранее?	0				0.0	0.19881868362426758
"День добрый. Скажите, как лучше поступить. Работнику выплатили отпускные в конце августа. За сентябрь. В сентябре он взял б/л на неделю. Пересчитала отпускные. И начисления в сентябре получились ""по минусу"". Что мне нужно скорректировать теперь, чтобы отчетность по страховым взносам правильно составить?"	Как начислять и учитывать больничный лист в отпуске?	0				0.0	0.42890238761901855
Спасибо за ответ. А как быть с ведомостью на выплату отпускных выплата была 05.12.2023г, ясно что сумма выплаты останется без изменения, а как быть с ндфл, нужно ли изменить на исчисленный с 19000р?	Как изменить налоговую нагрузку при выплате отпускных с нулевой суммой?	0				0.0	0.40988993644714355
